url,title,snippet,text
https://www.webmd.com/lung-cancer/qa/how-is-surgery-used-to-treat-stage-0-lung-cancer,How is surgery used to treat Stage 0 Lung Cancer?,"This might sound extreme, but you can live a normal life with only one lung. From: 
Non-Small-Cell Lung Cancer Treatment by Stage WebMD Medical Reference.",",,ANSWER,If your health is good overall, surgery is probably all you need at this stage. Depending on where the tumor is, your surgeon will suggest one of these procedures:,Wedge resection: The tumor and a small amount of normal lung tissue are removed,Segmental resection (segmentectomy): Part of the lung where the tumor is located gets taken out.,Sleeve resection: A lobe of the lung and a part of the airway are cut out.,Lobectomy: An entire lobe of the lung is removed. (The right lung is divided into three lobes; the left lung has two lobes.) Most surgeons prefer this option since it offers the best chance for cure.,Pneumonectomy: The entire lung is taken out. This might sound extreme, but you can live a normal life with only one lung.,From: Non-Small-Cell Lung Cancer Treatment by Stage WebMD Medical Reference,Reviewed
									by Laura J. Martin on December 19, 2018,Medically
										 
										Reviewed
										 
										on 12/19/2018,,SOURCES:,,American Cancer Society: “How is non-small cell lung cancer staged?”,,American Cancer Society: “Surgery for non-small cell lung cancer.”,,The Society of Thoracic Surgeons: “Lung/Thoracic Surgery.”,,American Cancer Society: “Treatment choices by stage for non-small cell lung cancer.”,,Penn Medicine: “Photodynamic Therapy (PDT).”,,American Cancer Society: “Radiation therapy for non-small cell lung cancer.”,,McElnay, P. 
                      , May 6, 2014. Journal of Thoracic Disease,,UpToDate: “Patient Information: Non-small cell lung cancer treatment; Stage I to III cancer (Beyond the Basics)."",,American Cancer Society: “Targeted Therapies for non-small cell lung cancer.”,,National Cancer Institute: “General Information About Non-Small Cell Lung Cancer (NSCLC),"" ""NCI Dictionary of Cancer Terms."",,Annals of Thoracic Medicine: “Bronchial Stents.”,,SOURCES:,,American Cancer Society: “How is non-small cell lung cancer staged?”,,American Cancer Society: “Surgery for non-small cell lung cancer.”,,The Society of Thoracic Surgeons: “Lung/Thoracic Surgery.”,,American Cancer Society: “Treatment choices by stage for non-small cell lung cancer.”,,Penn Medicine: “Photodynamic Therapy (PDT).”,,American Cancer Society: “Radiation therapy for non-small cell lung cancer.”,,McElnay, P. 
                      , May 6, 2014. Journal of Thoracic Disease,,UpToDate: “Patient Information: Non-small cell lung cancer treatment; Stage I to III cancer (Beyond the Basics)."",,American Cancer Society: “Targeted Therapies for non-small cell lung cancer.”,,National Cancer Institute: “General Information About Non-Small Cell Lung Cancer (NSCLC),"" ""NCI Dictionary of Cancer Terms."",,Annals of Thoracic Medicine: “Bronchial Stents.”,How is photodynamic therapy (PDT) used to treat Stage 0 lung cancer?,WAS THIS ANSWER HELPFUL,SHARE,""ALEXA, ASK WEBMD"",THIS TOOL DOES NOT PROVIDE MEDICAL ADVICE. It is intended for general informational purposes only and does not address individual circumstances. It is not a substitute for professional medical advice, diagnosis or treatment and should not be relied on to make decisions about your health. Never ignore professional medical advice in seeking treatment because of something you have read on the WebMD Site. If you think you may have a medical emergency, immediately call your doctor or dial 911.,This tool does not provide medical advice. See
            additional information.,,Other Answers On:,© 2005 - 2019 WebMD LLC. All rights reserved.,WebMD does not provide medical advice, diagnosis or treatment.,See additional information."
https://www.cancercenter.com/cancer-types/lung-cancer/stages,Understand how Lung Cancer is Staged and Graded | CTCA,"Lung cancer stage is based on tumor size, location, existing in lymph nodes and 
... Stage 0: Cancer at this stage is also known as carcinoma in situ. ... Common 
treatments for stage IV non-small cell lung cancer: In stage IV lung cancer, ...","Call us 24/7,Experiencing symptoms that concern you?,Making an educated lung cancer treatment decision begins with the stage, or progression, of the disease. Using the results from your diagnostic tests , your care team at Cancer Treatment Centers of America ® (CTCA) will develop an appropriate treatment plan for you.,If you have been recently diagnosed, we will review your pathology to confirm you have received the correct diagnosis and staging information, and develop a personalized treatment plan for you. If you have a cancer recurrence, we will perform comprehensive testing and identify a treatment approach tailored to your needs.,Small cell lung cancer (SCLC) makes up less than 20 percent of lung cancers and is typically caused by tobacco smoking. It often starts in the bronchi, then quickly grows and spreads to other parts of the body, including the lymph nodes. Small cell lung cancer stages are classified in two ways:,Limited stage: The cancer is found in one lung, sometimes including nearby lymph nodes.,Extensive stage: Cancer has spread to the other lung, the fluid around the lung (the pleura) or to other organs in the body.,Non-small cell lung cancer (NSCLC) staging uses the TNM system:,T (tumor): This describes the size of the original tumor.,N (node): This indicates whether cancer is present in the lymph nodes.,M (metastasis): This refers to whether cancer has spread to other parts of the body, usually the liver, bones or brain.,A number (0-4) or the letter X is assigned to each factor. A high number indicates increasing severity. The letter X means the information could not be assessed. For instance, a T1 score indicates a smaller tumor than a T2 score. Once the T, N and M scores have been assigned, an overall stage is assigned.,The stages of NSCLC are:,Occult-stage: Cancer cells are found in sputum, but no tumor can be found in the lung by imaging tests or bronchoscopy , or the tumor is too small to be checked.,Stage 0: Cancer at this stage is also known as carcinoma in situ. The cancer is tiny in size and has not spread into deeper lung tissues or outside the lungs.,Stage I (stage 1): Cancer may be present in the underlying lung tissues, but the lymph nodes remain unaffected.,Stage II (stage 2): The cancer may have spread to nearby lymph nodes or into the chest wall.,Stage III (stage 3): The cancer is continuing to spread from the lungs to the lymph nodes or to nearby structures and organs, such as the heart, trachea and esophagus.,Stage IV non-small cell lung cancer (NSCLC) is the most advanced form of the disease. In stage IV , the cancer has metastasized, or spread, beyond the lungs into other areas of the body. About 40 percent of NSCLC patients are diagnosed with lung cancer when they are in stage IV. The five-year survival rate for those diagnosed with stage IV lung cancer is less than 10 percent.,Numerous treatment options are available for patients with advanced-stage lung disease at Cancer Treatment Centers of America ® (CTCA). We also provide therapies to ease the symptoms that can be associated with NSCLC, while improving your quality of life.,M1B stage IV lung cancer means that the cancer has spread to distant lymph nodes or to other organs such as the bones, liver, adrenal gland, kidneys or brain.,Common treatments for stage IV non-small cell lung cancer: In stage IV lung cancer, chemotherapy is often the recommended course of treatment. Immunotherapy may also be recommended as a secondary approach.,We also provide therapies to ease the symptoms that can be associated with NSCLC, while improving your quality of life.,Learn more about stage IV lung cancer,Next topic: How is lung cancer diagnosed?,Donate to Cancer Research,Make a difference in the fight against cancer by donating to cancer research,Gateway for Cancer Research is a 501(c)(3) non-profit organization. Tax-ID: 73-1386920,888.552.6760,© 2020 IPB"
https://www.cancer.gov/publications/dictionaries/cancer-terms/def/stage-0-non-small-cell-lung-carcinoma-in-situ,Definition of stage 0 non-small cell lung carcinoma in situ - NCI ...,"These abnormal cells may become cancer and spread into nearby normal tissue. 
... Stage 0 non-small cell lung carcinoma in situ may be adenocarcinoma in situ (
AIS) or squamous cell carcinoma in ... Non-Small Cell Lung Cancer Treatment ...","The NCI Dictionary of Cancer Terms features 8,547 terms related 
        to cancer and medicine.,We offer a widget that you can add to your website to let users look up cancer-related terms. Get NCI’s Dictionary of Cancer Terms Widget ."
