url,title,snippet,text
https://www.onhealth.com/content/1/lung_cancer,"Lung Cancer Symptoms, Stages, Treatment","Jul 22, 2016 ... This form of cancer tends to spread quickly. Illustration of lymph nodes around 
the lungs. Lung Cancer Stages: Stage 0 Through ...","Lung cancer has emerged as the leading killer of men and women stricken with invasive cancer, affecting husbands and wives, friends and neighbors, and causing suffering for many families. In the United States, lung cancer overtook breast cancer as the leading cause of cancer deaths in women in 1987. Lung cancer deaths account for a quarter of all American cancer deaths, killing more people every year than prostate, breast, and colon cancer combined. Over 157,000 Americans are estimated to have died from lung cancer in 2015.,This disease is difficult to detect in its early stages, and treatments for lung cancer in its later stages provide a poor prognosis: Those with stage IV non-small cell lung cancer—the most common type—have an estimated 1 percent survival rate five years after diagnosis. The other type of lung cancer—small cell lung cancer—is even more aggressive. According to the American Cancer Society, the overall survival rate for lung cancer as of Jan. 1, 2014 stands at just 3%.,The exact cause of lung cancer is still being investigated. Certain risk factors have been shown to play a part in causing cells to become cancerous. Risk factors for lung cancer include smoking , exposure to air pollution, and genetics.,The major cause of lung cancer in men and women is mainly due to cigarette smoking . In 1876, a machine was invented to make rolled-up cigarettes and thus provided cheap tobacco products to almost everyone. At that time, lung cancer was relatively rare. Smoking dramatically increased and so did lung cancers following this innovation. Currently about 90% of all lung cancers are related to smoking. Radon gas, pollution, toxins, and other factors contribute to the remaining 10%.,Cigarettes and cigarette smoke contains over 70 cancer-causing chemicals (carcinogens). Some of the carcinogens found in cigarette smoke include:,Cigar smoke is particularly heavy on tobacco-specific nitrosamines (TSNAs), which are considered particularly cancerous.,Cigarette smoke damages and can kill hair-like projections on airway cells termed cilia. The cilia normally sweep out toxins, carcinogens, viruses , and bacteria. When the cilia are damaged or destroyed by smoke, all of these items may accumulate in the lungs and may cause problems such as infections or lung cancer.,Unfortunately, lung cancers often have either no early symptoms or nonspecific early symptoms that people often dismiss. About 25% of people with lung cancer and no symptoms are diagnosed after having a chest X-ray or CT during a routine test or as a procedure for other problems. Lung cancer symptoms that may be detected are included below.,Screening for lung cancer is usually accomplished using three methods.,A physical exam will look for signs of wheezing, shortness of breath, cough, pain and other possible signs of lung cancer. Depending on the advancement of the cancer, other early signs of lung cancer symptoms may include a lack of sweating , dilated neck veins, face swelling, excessively constricted pupils, and other signs. The physical exam will also include the patient's history of smoking and a chest X-ray.,A sputum cytology exam involves a microscopic examination of a patient's mucus (sputum).,This method of CT scanning builds a detailed image of the body's internal workings. Inside a spiral CT machine, detailed images are taken of the relevant parts of the patient's body. Those images are then linked to an X-ray machine to create 3D images of the patient's internal organs. These images may reveal potentially cancerous tumors.,A study by researchers suggested that people aged 55 to 74 years old who had smoked at least one pack of cigarettes a day for 30 or more years may benefit from a spiral CT study of the lungs. At best, the screening methods find about 30% of lung cancers leaving the bulk (about 70%) cancers of lung undetected. In addition, some test results are not clearly diagnostic which can lead to patient concerns and possibly unnecessary biopsies or surgeries.,If the screening tests suggest a person has lung cancer, definitive diagnostic tests may be done by a pathologist. The pathologist will examine the patient's lung cells in sputum, phlegm, or from a biopsy sample to type and stage the lung cancer.,As stated previously, a tissue sample taken from the patient's suspected cancer is usually the best method to establish a definitive lung cancer diagnosis. In general, lung biopsies are obtained by either needle biopsy, a lung bronchoscopy technique, or by surgical removal of tissue. Many other tests may be done to get more information about the cancer's spread.,See the following slides for types of lung cancer and lung cancer stages, including stage IV lung cancer.,There are only two major types of lung cancers: small cell lung cancer and non-small cell lung cancers. Less than 5% of lung cancer tumors will take the form of a carcinoid tumor, while other cancerous tumors are even more rare, including adenoid cystic carcinomas, lymphomas, and sarcomas. Although cancer from another part of the body may spread to the lungs, these are not categorized as lung cancer.,Non-small cell lung cancers are the most common type of lung cancer. These cancers account for about 90% of all lung cancers and are less aggressive than small cell lung cancers, meaning they spread to other tissues and organs more slowly.,Small cell lung cancer, also called oat cell lung cancer, accounts for about 10% of all lung cancers. This form of cancer tends to spread quickly.,After the type of lung cancer is determined, the type is then assigned a lung cancer stage. The stage indicates how much the cancer has spread in the body (for example, to the lymph nodes or to distant organs like the brain). Stages for non-small cell lung cancers are different from small cell lung cancers. The stages listed below are taken from the National Cancer Institute's lung cancer staging information:,Limited stage: In this form, small cell lung cancer is limited to one side of the chest, typically in the lungs and lymph nodes. About one in three people with small cell lung cancer have limited stage cancer upon the first diagnosis.,Extensive stage: This refers to small cell lung cancer that has spread throughout one lung, spread into both lungs, to lymph nodes on the other side of the chest or to other body parts. About two in three people with small cell lung cancer have extensive stage cancer upon first diagnosis.,Occult (hidden) stage: In this stage, cancer cells appear in a sputum cytology exam or other test, though no tumor location can be found.,Stage 0 ( carcinoma in situ ): In this lung cancer stage, cancer cells are only found in the top layer of cells lining air passages and has not crept deeper into the lungs or spread beyond the air passages.,Stage I: A small lung cancer tumor (less than 3 centimeters across) is discovered, but has not spread to surrounding lung membranes, lymph nodes, or the main bronchial branches of the lungs.,Stage II: There are several ways that stage II lung cancer may be diagnosed. One is that the lung cancer has spread to lymph nodes near the lungs.,Stage III: As in stage II lung cancer, stage III has several definitions. One is that the lung cancer is found in both the lung and lymph nodes in the middle of the chest. Stage III lung cancer is divided into two subsets.,Stage IV: This is the most advanced stage of lung cancer. The cancer can be any size, but two of these three things have happened:,The American Cancer Society statistics are currently based on people diagnosed between 1998 and 2000 so the data may not reflect the effects of newer treatments. The data indicates that survival rates of patients living 5 years after being diagnosed with non-small cell lung cancers was dependent on the stage of the disease.,Stage I was about 49% (with surgical removal, about 75%) while stage IV survival was about 1%. Small cell lung cancers are more aggressive and the data, like that for non-small cell lung cancers, is not reflective of current survival rates.,However, even some data collected as late as 2008 indicates slow progress in increasing 5-year survival rates. The overall rate of both limited-stage and extensive-stage small cell lung cancer is about 6%. The overall rate of all stages (I to IV combined) non-small cell lung cancer is about 15%.,Early stage (stage 0 or even some stage I) cancer treatment of non-small cell lung cancer may benefit from surgery. Part or all of a lung segment that contains the cancer may be removed; in some individuals, this may result in a cure. However, many patients still undergo chemotherapy, radiation therapy or both to kill any cancer cells not removed by surgery. Because small cell lung cancers are almost never diagnosed early, surgery (and other treatments) may prolong life but rarely, if ever, result in a cure.,Most small cell and non-small-cell lung cancers are treated with chemotherapy; they may also be treated with radiation therapy and surgery. In many patients with advanced disease, these methods may be used together, depending on the patient's condition and recommendations by their cancer doctors.,New therapeutic treatments are being tried; for example, some therapies termed targeted therapies are designed to prevent or stop lung cancer cells from growing by targeting the new blood vessels that are needed to allow the cancer cells to survive and grow; other treatments target growth and multiplication of lung cancer cells by interfering with chemical signals required by growing or multiplying cancer cells (illustrated in this slide).,In addition to targeted therapies, there are a number of clinical trials that a person may qualify for. Some may be available in your hometown. These clinical trials have patients try the newest potentially helpful therapeutic methods and drugs to combat lung cancers. The National Cancer Institute's web site listed below offers a list of current clinical trials; you and your doctor may find a clinical trial that may help you with this disease.,After a diagnosis of lung cancer, it is not unusual to feel depressed and upset. However, research is ongoing and it is possible to survive and extend your life with treatment. Even with the diagnosis, there is evidence that people who develop a healthy lifestyle and stop smoking do better than those who do not change.,Tobacco smokers put others at risk of developing lung cancer. A nonsmoker (wife, child, significant other) who lives with a smoker has a 20% to 30% increase in risk of developing lung cancer due to exposure to smoke concentrations in their local environment.,Although smoking results in the highest risk of causing lung cancers, other environmental exposures to certain compounds and chemicals increase the risk of lung cancer. Such agents as asbestos, uranium, arsenic, benzene, and many others increase the risk for developing lung cancers. Exposure to asbestos may cause lung cancer (mesothelioma) many years after the initial exposure so people may be at risk for lung disease for decades (10 to 40 years).,Another chemical, radon gas, is considered to be the second leading cause of lung cancer. It occurs naturally but can seep into homes and collect in basements and crawl spaces. It is colorless and odorless but can be detected with relatively simple and inexpensive test kits. Smokers exposed to this gas have a higher risk of developing lung cancer than nonsmokers.,There are a number of investigators that suggest air pollution contributes to the development of lung cancers. Several studies present data that airborne pollutants like diesel exhaust may cause some people to develop lung cancers. Researchers estimate that about 5% of lung cancers are due to air pollutants.,Although much is understood about lung cancers, there are still many things and situations that are unclear. For example, it is unclear why some families have a history of individuals with lung cancer and no clear risk factors. The same is true for some patients who develop lung cancers with no clear risk factors. Another occurrence such as drinking water that has high arsenic concentrations may increase lung cancer risk but how the process happens is not clear. In addition, the reason why adenocarcinoma in the lungs is more common in nonsmokers than smokers is also not known.,For the majority of lung cancers, prevention is possible if a person never smokes and avoids second-hand smoke . For smokers who quit -- within 10 years -- the risk of getting lung cancer drops to about the same risk as if they had never smoked. Avoiding other risk factors (for example, certain chemicals or compounds like benzene or asbestos or air pollution) may also prevent some people from developing lung cancers.,For more information about Lung Cancer, please consider the following:,IMAGES PROVIDED BY:,REFERENCES:"
https://www.cancer.net/cancer-types/lung-cancer-non-small-cell/stages,Lung Cancer - Non-Small Cell: Stages | Cancer.Net,"This is because lung cancer is different in each person and treatment works 
differently ... There are 5 stages for NSCLC: stage 0 (zero) and stages I through 
IV (1 ...","Skip to Content,,Search,Menu,ON THIS PAGE: You will learn about how doctors describe a cancer’s growth or spread. This is called the stage. Use the menu to see other pages.,Staging is a way of describing where the cancer is located, if or where it has spread, and whether it is affecting other parts of the body. Doctors use diagnostic tests to find out the cancer’s stage, so staging may not be complete until all of the tests are finished. Knowing the stage helps the doctor to decide what kind of treatment is best and can help predict a patient’s prognosis, which is the chance of recovery. There are different stage descriptions for different types of cancer.,In general, a lower number stage of NSCLC is linked with a better outcome. However, no doctor can predict how long a patient will live with lung cancer based only on the stage of disease. This is because lung cancer is different in each person and treatment works differently for each tumor.,The stage of NSCLC is based on a combination of several factors, including:,The size and location of the tumor,Whether it has spread to the lymph nodes and/or other parts of the body.,There are 5 stages for NSCLC: stage 0 (zero) and stages I through IV (1 through 4). One way to determine the staging of NSCLC is to find out whether the cancer can be completely removed by a surgeon. To completely remove the lung cancer, the surgeon must remove the cancer, along with the surrounding, healthy lung tissue. Learn more about treatment options for NSCLC .,This is called in situ disease, meaning the cancer is “in place” and has not grown into nearby tissues and spread outside the lung.,A stage I lung cancer is a small tumor that has not spread to any lymph nodes, making it possible for a surgeon to completely remove it. Stage I is divided into 2 substages based on the size of the tumor:,Stage IA tumors are 3 centimeters (cm) or less in size. Stage IA tumors may be further divided into IA1, IA2, or IA3 based on the size of the tumor.,Stage IB tumors are more than 3 cm but 4 cm or less in size.,Stage II lung cancer is divided into 2 substages:,A stage IIA cancer describes a tumor larger than 4 cm but 5 cm or less in size that has not spread to the nearby lymph nodes.,Stage IIB lung cancer describes a tumor that is 5 cm or less in size that has spread to the lymph nodes. A stage IIB cancer can also be a tumor more than 5 cm wide that has not spread to the lymph nodes.,Sometimes, stage II tumors can be removed with surgery, and other times, more treatments are needed.,Stage III lung cancers are classified as either stage IIIA, IIIB, or IIIC. The stage is based on the size of the tumor and which lymph nodes the cancer has spread to. Stage III cancers have not spread to other distant parts of the body.,For many stage IIIA cancers and nearly all stage IIIB cancers, the tumor is difficult, and sometimes impossible, to remove with surgery. For example, the lung cancer may have spread to the lymph nodes located in the center of the chest, which is outside the lung. Or the tumor may have grown into nearby structures in the lung. In either situation, it is less likely that the surgeon can completely remove the cancer because removal of the cancer must be performed bit by bit.,Stage IV means the lung cancer has spread to more than 1 area in the other lung, the fluid surrounding the lung or the heart, or distant parts of the body through the bloodstream. Once cancer cells get into the blood, the cancer can spread anywhere in the body. But, NSCLC is more likely to spread to the brain, bones, liver, and adrenal glands. Stage IV NSCLC is divided into 2 substages:,In general, surgery is not successful for most stage III or IV lung cancers. Lung cancer can also be impossible to remove if it has spread to the lymph nodes above the collarbone. It can also be impossible to remove if it has grown into vital structures within the chest. These vital structures include the heart, large blood vessels, or the main breathing tubes leading to the lungs. In these situations, the doctor will recommend other treatment options .,Recurrent cancer is cancer that has come back after treatment. If the cancer does return, there will be another round of tests to learn about the extent of the recurrence. These tests and scans are often similar to those done at the time of the original diagnosis .,Used with permission of the American College of Surgeons, Chicago, Illinois. The original and primary source for this information is the AJCC Cancer Staging Manual, Eighth Edition (2017) published by Springer International Publishing.,The type and stage of NSCLC and the patient’s overall health influence prognosis. Although NSCLC is treatable at any stage, only some people with certain stages can be cured.,Doctors measure a patient’s general strength and health using an index known as performance status. Patients who are strong enough to go about their daily activities without assistance and work outside the home can safely receive chemotherapy, radiation therapy, and/or surgery. Treatment may not be as effective for patients with bone or liver metastases from lung cancer, excessive weight loss, ongoing cigarette use, or pre-existing medical conditions, such as heart disease or emphysema.,It is important to note that a patient’s age has never been useful in predicting whether a patient will benefit from treatment. The average age of patients with lung cancer in the United States is 71. A patient’s age should never be used as the only reason for deciding what treatment is best, especially for older patients who are otherwise physically fit and have no medical problems besides lung cancer.,Information about the cancer’s stage will help the doctor recommend a specific treatment plan. The next section in this guide is T ypes of Treatment . Use the menu to choose a different section to read in this guide.,Cancer.Net Guide Lung Cancer - Non-Small Cell,View All Pages,Trusted, compassionate information for people with cancer and their families and caregivers, from the American Society of Clinical Oncology (ASCO), the voice of the world’s cancer physicians and oncology professionals.,Find a Cancer Doctor,© 2005-2020 American Society of Clinical Oncology (ASCO). All rights reserved worldwide"
https://www.cancer.ca/en/cancer-information/cancer-type/lung/treatment/stage-0-carcinoma-in-situ/?region=on,Treatments for stage 0 non–small cell lung cancer - Canadian ...,"The following are treatment options for stage 0 non — small cell lung cancer. The 
types of treatments given are based on the unique needs of the person with ...","CCS is actively monitoring and responding to the recommendations of the Public Health Agency of Canada regarding coronavirus disease (COVID-19).,Lung cancer,Select the text below and copy the link.,The following are treatment options for stage 0 (carcinoma in-situ) non–small cell lung cancer. Your healthcare team will suggest treatments based on your needs and work with you to create a treatment plan.,Endobronchial therapies are the standard treatment for stage 0 tumours that are found in the large bronchial tubes of the lung. Treatment options include:,Surgery is the standard treatment for stage 0 found in the outer tissues of the lung, for people who are well enough to have surgery.,Wedge or segmental resection is used to remove the tumour along with a margin of healthy lung tissue.,Stereotactic body radiation therapy is used to treat stage 0 non–small cell lung cancer in people who have poor lung function and cannot have surgery.,,Or write us. We will reply by email or phone if you leave us your details. If we are not able to reach you by phone, we will leave a voicemail message.,,Read more,Discover how 16 factors affect your cancer risk and how you can take action with our interactive tool – It’s My Life! Presented in partnership with Desjardins.,Learn more,,© 2020 Canadian Cancer Society All rights reserved. Registered charity: 118829803 RR 0001"
https://clinicaltrials.gov/ct2/show/NCT00526461,Photodynamic Therapy Using HPPH in Treating Patients With Stage ...,"... Using HPPH in Treating Patients With Stage 0 Non-Small Cell Lung Cancer ... 
Photodynamic therapy uses a drug, such as HPPH, that is absorbed by tumor ...","Study record managers: refer to the Data Element Definitions if submitting registration or results information.,Search for terms,RATIONALE: Photodynamic therapy uses a drug, such as HPPH, that is absorbed by tumor cells. The drug becomes active when it is exposed to a certain kind of light. When the drug is active, tumor cells are killed.,PURPOSE: This phase I trial is studying the side effects and best dose of photodynamic therapy using HPPH in treating patients with stage 0 non-small cell lung cancer.,OBJECTIVES:,Primary,Secondary,OUTLINE: Patients receive HPPH IV over 1 hour on day 1. Approximately 2 days later, patients undergo photodynamic therapy (PDT) using laser light passed through the biopsy channel of an endoscope. Patients undergo endoscopic debridement on day 5. If viable tumor is found outside of the initial treatment area, patients may receive another dose of laser light without additional HPPH at that time.,After completion of study treatment, patients are followed at 4-6 weeks, 6 months, and periodically thereafter.,,,,,,,,Choosing to participate in a study is an important personal decision. Talk with your doctor and family members or friends about deciding to join a study. To learn more about this study, you or your doctor may contact the study research staff using the contacts provided below. For general information, Learn About Clinical Studies.,DISEASE CHARACTERISTICS:,Biopsy confirmed carcinoma in situ (CIS) or microinvasive bronchogenic non-small cell lung carcinoma,Stage 0 (CIS or microinvasive) disease, meeting all of the following criteria:,PATIENT CHARACTERISTICS:,PRIOR CONCURRENT THERAPY:,,To learn more about this study, you or your doctor may contact the study research staff using the contact information provided by the sponsor.,Please refer to this study by its ClinicalTrials.gov identifier (NCT number): NCT00526461"
