url,title,snippet,text
https://www.cancer.org/cancer/lung-cancer/treating-non-small-cell/by-stage.html,Non-small Cell Lung Cancer Treatment by Stage,"Oct 1, 2019 ... For some stage 0 cancers, treatments such as photodynamic therapy (PDT), laser 
therapy, or brachytherapy (internal radiation) may be ...","What cancer patients, their families, and caregivers need to know about the coronavirus . How COVID-19 is impacting our patient services .,Whether you or someone you love has cancer, knowing what to expect can help you cope. From basic information about cancer and its causes to in-depth information on specific cancer types – including risk factors, early detection, diagnosis, and treatment options – you’ll find it here.,You can help reduce your risk of cancer by making healthy choices like eating right, staying active and not smoking. It’s also important to follow recommended screening guidelines, which can help detect certain cancers early.,Whether you want to learn about treatment options, get advice on coping with side effects, or have questions about health insurance, we’re here to help. We can even find you a free ride to treatment or a free place to stay when treatment is far from home.,Our team of expert journalists brings you all angles of the cancer story – from breaking news and survivor stories to in-depth insights into cutting-edge research.,What does it take to outsmart cancer? Research. We’ve invested more than $4.9 billion in cancer research since 1946, all to find more – and better – treatments, uncover factors that may cause cancer, and improve cancer patients’ quality of life.,We couldn’t do what we do without our volunteers and donors. Together, we’re making a difference – and you can, too. Become a volunteer, make a tax-deductible donation, or participate in a fundraising event to help us save lives.,The American Cancer Society couldn’t do what we do without the support of our partners. Learn more about these partnerships and how you too can join us in our mission to save lives, celebrate lives, and lead the fight for a world without cancer.,At the American Cancer Society, we’re on a mission to free the world from cancer. Until we do, we’ll be funding and conducting research, sharing expert information, supporting patients, and spreading the word about prevention. All so you can live longer — and better.,,The treatment options for non-small cell lung cancer (NSCLC) are based mainly on the stage (extent) of the cancer, but other factors, such as a person’s overall health and lung function, as well as certain traits of the cancer itself, are also important.,If you smoke, one of the most important things you can do to be ready for treatment is to try to quit . Studies have shown that patients who stop smoking after a diagnosis of lung cancer tend to have better outcomes than those who don’t.,For these cancers, malignant cells are seen on sputum cytology but no obvious tumor can be found with bronchoscopy or imaging tests. They are usually early-stage cancers. Bronchoscopy and possibly other tests are usually repeated every few months to look for a tumor. If a tumor is found, treatment will depend on the stage.,Because stage 0 NSCLC is limited to the lining layer of airways and has not invaded deeper into the lung tissue or other areas, it is usually curable by surgery alone. No chemotherapy or radiation therapy is needed.,If you are healthy enough for surgery , you can usually be treated by segmentectomy or wedge resection (removal of part of the lobe of the lung). Cancers in some locations (such as where the windpipe divides into the left and right main bronchi) may be treated with a sleeve resection, but in some cases they may be hard to remove completely without removing a lobe (lobectomy) or even an entire lung (pneumonectomy).,For some stage 0 cancers, treatments such as photodynamic therapy (PDT), laser therapy, or brachytherapy (internal radiation) may be alternatives to surgery. If your cancer is truly stage 0, these treatments should cure you.,If you have stage I NSCLC, surgery may be the only treatment you need. This may be done either by taking out the lobe of the lung that has the tumor (lobectomy) or by taking out a smaller piece of the lung (sleeve resection, segmentectomy, or wedge resection). At least some lymph nodes in the lung and in the space between the lungs will also be removed and checked for cancer.,Segmentectomy or wedge resection is generally an option only for very small stage I cancers and for patients with other health problems that make removing the entire lobe dangerous. Still, most surgeons believe it is better to do a lobectomy if the patient can tolerate it, as it offers the best chance for cure.,For people with stage I NSCLC that has a higher risk of coming back (based on size, location, or other factors), adjuvant chemotherapy after surgery may lower the risk that cancer will return. But doctors aren’t always sure how to determine which people are likely to be helped by chemo. New lab tests that look at the patterns of certain genes in the cancer cells may help with this. Studies are now being done to see if these tests are accurate.,After surgery, the removed tissue is checked to see if there are cancer cells at the edges of the surgery specimen (called positive margins ). This could mean that some cancer has been left behind, so a second surgery might be done to try to ensure that all the cancer has been removed. (This might be followed by chemotherapy as well.) Another option might be to use radiation therapy after surgery.,If you have serious health problems that prevent you from having surgery, you may get stereotactic body radiation therapy (SBRT) or another type of radiation therapy as your main treatment. Radiofrequency ablation (RFA) may be another option if the tumor is small and in the outer part of the lung.,People who have stage II NSCLC and are healthy enough for surgery usually have the cancer removed by lobectomy or sleeve resection. Sometimes removing the whole lung (pneumonectomy) is needed.,Any lymph nodes likely to have cancer in them are also removed. The extent of lymph node involvement and whether or not cancer cells are found at the edges of the removed tissues are important factors when planning the next step of treatment.,After surgery, the removed tissue is checked to see if there are cancer cells at the edges of the surgery specimen.  This might mean that some cancer has been left behind, so a second surgery might be done to try to remove any remaining cancer. This may be followed by chemotherapy (chemo). Another option is to treat with radiation , sometimes  with chemo .,Even if positive margins are not found, chemo is usually recommended after surgery to try to destroy any cancer cells that might have been left behind. As with stage I cancers, newer lab tests now being studied may help doctors find out which patients need this adjuvant treatment and which are less likely to benefit from it.,If you have serious medical problems that would keep you from having surgery, you may get only radiation therapy as your main treatment.,Treatment for stage IIIA NSCLC may include some combination of radiation therapy , chemotherapy (chemo), and/or surgery . For this reason, planning treatment for stage IIIA NSCLC often requires input from a medical oncologist, radiation oncologist, and a thoracic surgeon. Your treatment options depend on the size of the tumor, where it is in your lung, which lymph nodes it has spread to, your overall health, and how well you are tolerating treatment.,For patients who can tolerate it, treatment usually starts with chemo, often combined with radiation therapy (also called chemoradiation). Surgery may be an option after this if the doctor thinks any remaining cancer can be removed and the patient is healthy enough. (In some cases, surgery may be an option as the first treatment.) This is often followed by chemo, and possibly radiation therapy if it hasn’t been given before.,For people who are not healthy enough for surgery, radiation therapy, which may be combined with chemo, is often used.,If surgery, radiation or chemoradiation are not considered tolerable treatment options, immunotherapy with pembrolizumab may be considered as first treatment.,Stage IIIB NSCLC has spread to lymph nodes that are near the other lung or in the neck, and may also have grown into important structures in the chest. These cancers can’t be removed completely by surgery . As with other stages of lung cancer, treatment depends on the patient’s overall health. If you are in fairly good health you may be helped by chemotherapy (chemo) combined with radiation therapy . Some people can even be cured with this treatment. If the cancer stays under control after 2 or more treatments of chemoradiation, the immunotherapy drug durvalumab can be given for up to a year to help keep the cancer stable.,Patients who are not healthy enough for this combination are often treated with radiation therapy alone, or, less often, chemo alone. If surgery, radiation, or chemoradiation are not considered tolerable treatment options, immunotherapy with pembrolizumab may be considered as first treatment.,These cancers can be hard to treat, so taking part in a clinical trial of newer treatments may be a good option for some people.,Stage IV NSCLC is widespread when it is diagnosed. Because these cancers have spread to distant sites, they are very hard to cure. Treatment options depend on where the cancer has spread, the number of tumors, and your overall health.,If you are in otherwise good health, treatments such as surgery , chemotherapy (chemo), targeted therapy , immunotherapy , and radiation therapy may help you live longer and make you feel better by relieving symptoms, even though they aren’t likely to cure you.,Other treatments, such as photodynamic therapy (PDT) or laser therapy, may also be used to help relieve symptoms . In any case, if you are going to be treated for advanced NSCLC, be sure you understand the goals of treatment before you start.,Cancer that is limited in the lungs and has only spread to one other site (such as the brain) is not common, but it can sometimes be treated (and even potentially cured) with surgery and/or radiation therapy to treat the area of cancer spread, followed by treatment of the cancer in the lung. For example, a single tumor in the brain may be treated with surgery or stereotactic radiation, or surgery followed by radiation to the whole brain. Treatment for the lung tumor is then based on its T and N stages, and may include surgery, chemo, radiation, or some of these in combination.,For cancers that have spread widely throughout the body, before any treatments start, your tumor will be tested for common gene mutations (such as in the EGFR , ALK , ROS1 , or BRAF genes). If one of these genes is mutated in your cancer cells, your first treatment will likely be a targeted therapy drug:,Your tumor cells might also be tested for the PD-L1 protein . Tumors with higher levels of PD-L1 are more likely to respond to certain immunotherapy drugs. So treatment with pembrolizumab (Keytruda) or atezolizumab (Tecentriq) with chemo, might be an option for treatment or pembrolizumab alone.,For most other cancers that have spread, chemo is usually at least part of the main treatment, as long as the person is healthy enough for it. Sometimes it might be used along with other types of drugs:,If the cancer has caused fluid buildup in the space around the lungs (a malignant pleural effusion), the fluid may be drained. If it keeps coming back, options include pleurodesis or placement of a catheter into the chest through the skin to let the fluid drain out. (Details of these are discussed in Palliative Procedures for Non-Small Cell Lung Cancer .),As with other stages, treatment for stage IV lung cancer depends on a person’s overall health. For example, some people not in good health might get only 1 chemo drug instead of 2. For people who can’t have chemo, radiation therapy is usually the treatment of choice. Local treatments such as laser therapy, PDT, or stent placement may also be used to help relieve symptoms caused by lung tumors.,Because treatment is unlikely to cure these cancers, taking part in a clinical trial of newer treatments may be a good option.,You can also find more information about living with stage IV cancer in Advanced Cancer .,If cancer continues to grow during treatment (progresses) or comes back (recurs), further treatment will depend on the location and extent of the cancer, what treatments have been used, and on the person’s health and desire for more treatment. It’s important to understand the goal of any further treatment – if it is to try to cure the cancer, to slow its growth, or to help relieve symptoms . It is also important to understand the benefits and risks.,If cancer continues to grow during initial treatment such as radiation therapy , chemotherapy (chemo) may be tried. If a cancer continues to grow during chemo as the first treatment, second-line treatment most often consists of a single chemo drug such as docetaxel or pemetrexed, or targeted therapy . If a targeted drug was the first treatment and is no longer working, another targeted drug or combination chemo might be tried. For some people with certain types of NSCLC, treatment with an immunotherapy drug such as nivolumab (Opdivo), pembrolizumab (Keytruda), or atezolizumab (Tecentriq) might be an option.,Smaller cancers that recur locally in the lungs can sometimes be retreated with surgery or radiation therapy (if it hasn’t been used before). Cancers that recur in the lymph nodes between the lungs are usually treated with chemo, possibly along with radiation if it hasn’t been used before. For cancers that return at distant sites, chemo, targeted therapies, and/or immunotherapy are often the treatments of choice.,For more on dealing with a recurrence, see Understanding Recurrence .,In some people, the cancer may never go away completely. These people may get regular treatments with chemo, radiation therapy, or other therapies to try to help keep the cancer in check. Learning to live with cancer that does not go away can be difficult and very stressful. It has its own type of uncertainty. Managing Cancer as a Chronic Illness talks more about this.,The American Cancer Society medical and editorial content team,Our team is made up of doctors and oncology certified nurses with deep knowledge of cancer care as well as journalists, editors, and translators with extensive experience in medical writing.,Araujo LH, Horn L, Merritt RE, Shilo K, Xu-Welliver M, Carbone DP. Ch. 69 - Cancer of the Lung: Non-small cell lung cancer and small cell lung cancer. In: Niederhuber JE, Armitage JO, Doroshow JH, Kastan MB, Tepper JE, eds. Abeloff’s Clinical Oncology . 6th ed. Philadelphia, Pa: Elsevier; 2020.,Chiang A, Detterbeck FC, Stewart T, Decker RH, Tanoue L. Chapter 48: Non-small cell lung cancer. In: DeVita VT, Lawrence TS, Rosenberg SA, eds. DeVita, Hellman, and Rosenberg’s Cancer: Principles and Practice of Oncology . 11th ed. Philadelphia, Pa: Lippincott Williams & Wilkins; 2019.,Drilon A, Laetsch TW, Kummar S, et al. Efficacy of Larotrectinib in TRK Fusion-Positive Cancers in Adults and Children. N Engl J Med . 2018;378(8):731–739.,Kim EY, Kim A, Lee G, Lee H, Chang YS. Different mutational characteristics of the subsets of EGFR-tyrosine kinase inhibitor sensitizing mutation-positive lung adenocarcinoma. BMC Cancer . 2018;18(1):1221.,National Cancer Institute. Physician Data Query (PDQ). Health Professional Version. Non-Small Cell Lung Cancer Treatment. 2019. Accessed at https://www.cancer.gov/types/lung/hp/non-small-cell-lung-treatment-pdq on June 12, 2019.,National Comprehensive Cancer Network. NCCN Clinical Practice Guidelines in Oncology: Non-Small Cell Lung Cancer. V.4.2019. Accessed at https://www.nccn.org/professionals/physician_gls/pdf/nscl.pdf on June 12, 2019.,Parsons A, Daley A, Begh R, Aveyard P. Influence of smoking cessation after diagnosis of early stage lung cancer on prognosis: Systematic review of observational studies with meta-analysis. BMJ . 2010;340:b5569.,Reck M and Rabe KF. Precision Diagnosis and Treatment for Advanced Non-Small-Cell Lung Cancer. N Engl J Med . 2017;377(9):849-861.,Thatcher N, Hirsch FR, Luft AV, Szczesna A, Ciuleanu TE, Dediu M, et al. Necitumumab plus gemcitabine and cisplatin versus gemcitabine and cisplatin alone as first-line therapy in patients with stage IV squamous non-small-cell lung cancer (SQUIRE): an open-label, randomised, controlled phase 3 trial. Lancet Oncol. 2015 Jul;16(7):763-74.,Araujo LH, Horn L, Merritt RE, Shilo K, Xu-Welliver M, Carbone DP. Ch. 69 - Cancer of the Lung: Non-small cell lung cancer and small cell lung cancer. In: Niederhuber JE, Armitage JO, Doroshow JH, Kastan MB, Tepper JE, eds. Abeloff’s Clinical Oncology . 6th ed. Philadelphia, Pa: Elsevier; 2020.,Chiang A, Detterbeck FC, Stewart T, Decker RH, Tanoue L. Chapter 48: Non-small cell lung cancer. In: DeVita VT, Lawrence TS, Rosenberg SA, eds. DeVita, Hellman, and Rosenberg’s Cancer: Principles and Practice of Oncology . 11th ed. Philadelphia, Pa: Lippincott Williams & Wilkins; 2019.,Drilon A, Laetsch TW, Kummar S, et al. Efficacy of Larotrectinib in TRK Fusion-Positive Cancers in Adults and Children. N Engl J Med . 2018;378(8):731–739.,Kim EY, Kim A, Lee G, Lee H, Chang YS. Different mutational characteristics of the subsets of EGFR-tyrosine kinase inhibitor sensitizing mutation-positive lung adenocarcinoma. BMC Cancer . 2018;18(1):1221.,National Cancer Institute. Physician Data Query (PDQ). Health Professional Version. Non-Small Cell Lung Cancer Treatment. 2019. Accessed at https://www.cancer.gov/types/lung/hp/non-small-cell-lung-treatment-pdq on June 12, 2019.,National Comprehensive Cancer Network. NCCN Clinical Practice Guidelines in Oncology: Non-Small Cell Lung Cancer. V.4.2019. Accessed at https://www.nccn.org/professionals/physician_gls/pdf/nscl.pdf on June 12, 2019.,Parsons A, Daley A, Begh R, Aveyard P. Influence of smoking cessation after diagnosis of early stage lung cancer on prognosis: Systematic review of observational studies with meta-analysis. BMJ . 2010;340:b5569.,Reck M and Rabe KF. Precision Diagnosis and Treatment for Advanced Non-Small-Cell Lung Cancer. N Engl J Med . 2017;377(9):849-861.,Thatcher N, Hirsch FR, Luft AV, Szczesna A, Ciuleanu TE, Dediu M, et al. Necitumumab plus gemcitabine and cisplatin versus gemcitabine and cisplatin alone as first-line therapy in patients with stage IV squamous non-small-cell lung cancer (SQUIRE): an open-label, randomised, controlled phase 3 trial. Lancet Oncol. 2015 Jul;16(7):763-74.,Last Medical Review: October 1, 2019 Last Revised: October 1, 2019,American Cancer Society medical information is copyrighted material. For reprint requests, please see our Content Usage Policy .,Imagine a world free from cancer. Help make it a reality.,DONATE,Cancer Information, Answers, and Hope. Available Every Minute of Every Day.,© 2020 American Cancer Society, Inc. All rights reserved. The American Cancer Society is a qualified 501(c)(3) tax-exempt organization. Cancer.org is provided courtesy of the Leo and Gloria Rosen family."
https://www.verywellhealth.com/stage-0-non-small-cell-lung-cancer-2249377,Understanding Stage 0 Lung Cancer,"Nov 15, 2019 ... Stage 0 Non-Small Cell Lung Cancer. Definition, Symptoms, and Treatment for 
Carcinoma In Situ of the Lungs. By.","Stage 0 non-small cell lung cancer , also known as carcinoma in situ , is the earliest stage at which lung cancer can usually be detected. Lung cancer is rarely found at this stage, and when it is, it is often an incidental finding when testing is done for some other reason. In theory, lung cancer should be completely curable at this stage since it is noninvasive. That said, many people with stage 0 lung cancer have or develop second primary cancers , and learning about cancer prevention is an important part of treatment.,Stage 0 non-small cell lung cancer defines a tumor that is present in only a few layers of cells and has not grown beyond the inner lining of the lungs (something called the basement membrane). Stage 0 (carcinoma in situ) is considered non-invasive, meaning at this stage it is not yet capable of spreading to other regions. In contrast, stages I to IV lung cancer are considered invasive.,Oncologists use the TNM system to further define the stages of lung cancer, with T representing tumor size, N indicating the presence of lymph nodes that contain cancer cells, and M standing for metastases (the spread of the tumor to the other lung or distant regions in the body.,According to the TNM system , Stage 0 lung cancer is defined as:,Stage 0 lung cancer is very small and should have minimal, if any, symptoms. In fact, if any symptoms are present, they are likely related to another condition or another lung cancer. Since it is often found “accidentally,” during testing, whatever symptoms prompted testing in the first place are often present. These might include a persistent cough , shortness of breath , pain in the chest , back , or shoulders , or general symptoms such as fatigue.,The treatment of choice for stage 0 lung cancer is surgery . Radiation or chemotherapy is not usually used, though a specialized form of radiation called stereotactic body radiotherapy (SBRT) may be used if the area is inoperable or if a person will not tolerate surgery. Different types of surgery are commonly performed for lung cancer, and, depending on the location of the tumor, one of the less invasive types of surgery (for example a wedge resection ) or a segmental resection can often be performed.,In the past, a thoracotomy was often performed, a procedure in which a large incision is made in the chest, part of a rib removed, and tissue removed in this way. More recently, minimally invasive surgery known as video-assisted thoracoscopic surgery has been used for many of these cancers, especially small tumors such as stage 0 tumors, with a more rapid recovery and less pain.,Clinical trials are in progress looking at still less invasive procedures to treat stage 0 lung cancer, such as photodynamic therapy, radiofrequency ablation, or brachytherapy.,Since stage 0 lung cancer is by definition non-invasive, it should, in theory, be curable with surgery. Unfortunately, many people with stage 0 lung cancer have second primary cancers , and the prognosis depends on the stage of the more advanced cancer. Individuals with stage 0 lung cancer are also at risk of developing another lung cancer in the future.,Studies suggest that learning as much as you can about your cancer improves your outcome. Ask questions. Talk to your doctor about clinical trials that may be appropriate for you. Consider joining a support group . Ask for and allow your loved ones to help. A diagnosis of lung cancer at this early stage is a great opportunity to make changes that might give you a healthier future. Look at your lifestyle and see if you can do anything to lower your risk of developing lung cancer again:,If you've been treated for stage 0 lung cancer, your doctor will want to follow you periodically for the rest of your life. In theory, stage 0 lung cancer should be curable since it is not invasive, but caution is still in order. Importantly, having had lung cancer in the first place is a very significant risk factor for developing a second primary lung cancer. A second primary lung cancer refers to a separate lung cancer unrelated to your first cancer. Talk to your doctor about the best method and timing for followup to make sure that a new primary lung cancer would be caught as early as possible.,For those who have not had a previous lung cancer (even stage 0), lung cancer screening is now recommended for people who are:,People with other risk factors may wish to consider screening as well.,While screening is often recommended for people who smoke, it's important to note that the majority of people who develop lung cancer in 2019 are nonsmokers; they either never smoked or quit in the past. While heart disease drops off rapidly when people quit smoking, the risk of lung cancer persists and rarely returns to normal.,Stage 0 non-small cell lung cancer is the earliest stage of the disease, though there has been debate over whether ""carcinoma in situ"" should truly be considered cancer. Though the cells are clearly identifiable as cancer cells, there is theoretically no chance that they could spread (if removed). Since we don't currently have a screening tool that reliably detects lung cancer at this stage, many people are accidentally diagnosed are considered fortunate. Hopefully, tests will be developed in the near future that will change the detection of stage 0 lung cancer from being a providental accident to being intentional.,Limiting processed foods and red meats can help ward off cancer risk. These recipes focus on antioxidant-rich foods to better protect you and your loved ones. Sign up and get your guide!,Thank you, {{form.email}}, for signing up.,There was an error. Please try again.,American Joint Committee on Cancer. Lung Cancer Staging. 7th Edition .,National Cancer Institute. Non-Small Cell Lung Cancer Treatment (PDQ) – Health Professional Version .,,Thank you, {{form.email}}, for signing up.,There was an error. Please try again."
